{
  "schema_version": "2.0.0",
  "skeleton_id": "crawler_tripod_a",
  "family": "crawler",
  "locomotion_hint": "crawl",
  "status": "placeholder",
  "symmetry_pct": 40,
  "branches": [
    { "branch_id": "core", "template": "core1", "parent_branch": null, "attach_bone_index": 0,
      "origin_m": [0, 0.55, -0.25], "direction": [0, 0, 1], "up": [0, 1, 0], "length_m": 0.55,
      "size_class": "L", "side": "C", "required": true,
      "accepts": { "categories": ["core", "head"] },
      "connector_size_class": null, "gait": { "role": "core", "phase_rad": 0.0 } },
    { "branch_id": "leg_F", "template": "insect_leg4", "parent_branch": "core", "attach_bone_index": 0,
      "origin_m": [0, 0.5, 0.2], "direction": [0, -0.6, 1], "up": [0, 1, 0], "length_m": 0.9,
      "size_class": "M", "side": "C", "required": true,
      "accepts": { "categories": ["limb"] },
      "connector_size_class": "M", "gait": { "role": "locomotor", "phase_rad": 0.0 } },
    { "branch_id": "leg_BL", "template": "insect_leg4", "parent_branch": "core", "attach_bone_index": 0,
      "origin_m": [0.17, 0.5, -0.12], "direction": [0.866, -0.6, -0.5], "up": [0, 1, 0], "length_m": 0.9,
      "size_class": "M", "side": "L", "required": true,
      "accepts": { "categories": ["limb"] },
      "connector_size_class": "M", "gait": { "role": "locomotor", "phase_rad": 2.094395 } },
    { "branch_id": "leg_BR", "template": "insect_leg4", "parent_branch": "core", "attach_bone_index": 0,
      "origin_m": [-0.17, 0.5, -0.12], "direction": [-0.866, -0.6, -0.5], "up": [0, 1, 0], "length_m": 0.9,
      "size_class": "M", "side": "R", "required": true, "mirror_of": "leg_BL",
      "accepts": { "categories": ["limb"] },
      "connector_size_class": "M", "gait": { "role": "locomotor", "phase_rad": 4.18879 } },
    { "branch_id": "mouth", "template": "appendage1", "parent_branch": "core", "attach_bone_index": 0,
      "origin_m": [0, 0.52, 0.3], "direction": [0, -0.1, 1], "up": [0, 1, 0], "length_m": 0.35,
      "size_class": "S", "side": "C", "required": false, "optional_fill_pct": 70,
      "accepts": { "categories": ["appendage"] },
      "connector_size_class": "S", "gait": { "role": "manipulator", "phase_rad": 0.0 } },
    { "branch_id": "dorsal", "template": "tentacle8", "parent_branch": "core", "attach_bone_index": 0,
      "origin_m": [0, 0.78, -0.1], "direction": [0, 1, -0.35], "up": [0, 0, 1], "length_m": 1.1,
      "size_class": "M", "side": "C", "required": false, "optional_fill_pct": 50,
      "accepts": { "categories": ["limb", "tail"], "templates": ["tentacle8"] },
      "connector_size_class": "M", "gait": { "role": "sway", "phase_rad": 0.0 } }
  ]
}
