{
  "schema_version": "2.0.0",
  "skeleton_id": "biped_puppet_a",
  "family": "biped",
  "locomotion_hint": "biped",
  "status": "placeholder",
  "symmetry_pct": 60,
  "branches": [
    { "branch_id": "core", "template": "spine3", "parent_branch": null, "attach_bone_index": 0,
      "origin_m": [0, 1.0, 0], "direction": [0, 1, 0], "up": [0, 0, 1], "length_m": 0.8,
      "size_class": "L", "side": "C", "required": true,
      "accepts": { "categories": ["core"], "templates": ["spine3"] },
      "connector_size_class": null, "gait": { "role": "core", "phase_rad": 0.0 } },
    { "branch_id": "leg_L", "template": "limb3", "parent_branch": "core", "attach_bone_index": 0,
      "origin_m": [0.17, 1.0, 0], "direction": [0, -1, 0], "up": [0, 0, 1], "length_m": 1.0,
      "size_class": "M", "side": "L", "required": true,
      "accepts": { "categories": ["limb"] },
      "connector_size_class": "M", "gait": { "role": "locomotor", "phase_rad": 0.0 } },
    { "branch_id": "leg_R", "template": "limb3", "parent_branch": "core", "attach_bone_index": 0,
      "origin_m": [-0.17, 1.0, 0], "direction": [0, -1, 0], "up": [0, 0, 1], "length_m": 1.0,
      "size_class": "M", "side": "R", "required": true, "mirror_of": "leg_L",
      "accepts": { "categories": ["limb"] },
      "connector_size_class": "M", "gait": { "role": "locomotor", "phase_rad": 3.14159265 } },
    { "branch_id": "arm_L", "template": "limb3", "parent_branch": "core", "attach_bone_index": 2,
      "origin_m": [0.3, 1.66, 0], "direction": [0.3, -1, 0], "up": [0, 0, 1], "length_m": 0.95,
      "size_class": "M", "side": "L", "required": false, "optional_fill_pct": 75,
      "accepts": { "categories": ["limb"] },
      "connector_size_class": "M", "gait": { "role": "manipulator", "phase_rad": 3.14159265 } },
    { "branch_id": "arm_R", "template": "limb3", "parent_branch": "core", "attach_bone_index": 2,
      "origin_m": [-0.3, 1.66, 0], "direction": [-0.3, -1, 0], "up": [0, 0, 1], "length_m": 0.95,
      "size_class": "M", "side": "R", "required": false, "optional_fill_pct": 75, "mirror_of": "arm_L",
      "accepts": { "categories": ["limb"] },
      "connector_size_class": "M", "gait": { "role": "manipulator", "phase_rad": 0.0 } },
    { "branch_id": "head", "template": "head1", "parent_branch": "core", "attach_bone_index": 2,
      "origin_m": [0, 1.82, -0.08], "direction": [0, 0.35, 1], "up": [0, 1, 0], "length_m": 0.5,
      "size_class": "M", "side": "C", "required": true,
      "accepts": { "categories": ["head"] },
      "connector_size_class": "M", "gait": { "role": "head", "phase_rad": 0.0 } },
    { "branch_id": "arm_L_tip", "template": "appendage1", "parent_branch": "arm_L", "attach_bone_index": -1,
      "direction": [0.3, -1, 0], "up": [0, 0, 1], "length_m": 0.35,
      "size_class": "S", "side": "L", "required": false, "optional_fill_pct": 40,
      "accepts": { "categories": ["appendage"] },
      "connector_size_class": "S", "gait": { "role": "manipulator", "phase_rad": 3.14159265 } },
    { "branch_id": "arm_R_tip", "template": "appendage1", "parent_branch": "arm_R", "attach_bone_index": -1,
      "direction": [-0.3, -1, 0], "up": [0, 0, 1], "length_m": 0.35,
      "size_class": "S", "side": "R", "required": false, "optional_fill_pct": 40, "mirror_of": "arm_L_tip",
      "accepts": { "categories": ["appendage"] },
      "connector_size_class": "S", "gait": { "role": "manipulator", "phase_rad": 0.0 } }
  ]
}
